{
  "$schema": "https://json-schema.org/draft/2020-12/schema",
  "additionalProperties": false,
  "properties": {
    "limitations": {
      "items": {
        "maxLength": 400,
        "minLength": 1,
        "type": "string"
      },
      "maxItems": 12,
      "minItems": 1,
      "type": "array"
    },
    "overall_verdict": {
      "maxLength": 1600,
      "minLength": 1,
      "type": "string"
    },
    "preferred_system_ids": {
      "items": {
        "enum": [
          "sys_3b7608d8be4f1ef45f11e2ef",
          "sys_544d94026d3cd9da78cdc585",
          "sys_69d064e7ab48f457b1847a7c",
          "sys_6bb24da67b12cf5151b5d179"
        ],
        "type": "string"
      },
      "maxItems": 4,
      "minItems": 1,
      "type": "array"
    },
    "schema_version": {
      "enum": [
        "1"
      ],
      "type": "string"
    },
    "system_evaluations": {
      "items": {
        "additionalProperties": false,
        "properties": {
          "anonymous_system_id": {
            "enum": [
              "sys_3b7608d8be4f1ef45f11e2ef",
              "sys_544d94026d3cd9da78cdc585",
              "sys_69d064e7ab48f457b1847a7c",
              "sys_6bb24da67b12cf5151b5d179"
            ],
            "type": "string"
          },
          "coverage_x4": {
            "maximum": 4,
            "minimum": 0,
            "type": "integer"
          },
          "discovery_x4": {
            "maximum": 4,
            "minimum": 0,
            "type": "integer"
          },
          "editorial_readiness_x4": {
            "maximum": 4,
            "minimum": 0,
            "type": "integer"
          },
          "precision_x4": {
            "maximum": 4,
            "minimum": 0,
            "type": "integer"
          },
          "stability_x4": {
            "maximum": 4,
            "minimum": 0,
            "type": "integer"
          },
          "strengths": {
            "items": {
              "maxLength": 300,
              "minLength": 1,
              "type": "string"
            },
            "maxItems": 8,
            "minItems": 1,
            "type": "array"
          },
          "weaknesses": {
            "items": {
              "maxLength": 300,
              "minLength": 1,
              "type": "string"
            },
            "maxItems": 8,
            "minItems": 1,
            "type": "array"
          }
        },
        "required": [
          "anonymous_system_id",
          "discovery_x4",
          "coverage_x4",
          "precision_x4",
          "stability_x4",
          "editorial_readiness_x4",
          "strengths",
          "weaknesses"
        ],
        "type": "object"
      },
      "maxItems": 4,
      "minItems": 4,
      "type": "array"
    },
    "topic_clusters": {
      "items": {
        "additionalProperties": false,
        "properties": {
          "alignment_confidence": {
            "enum": [
              "high",
              "medium",
              "low"
            ],
            "type": "string"
          },
          "canonical_topic": {
            "maxLength": 120,
            "minLength": 1,
            "type": "string"
          },
          "cluster_id": {
            "pattern": "^topic_[0-9]{3}$",
            "type": "string"
          },
          "members": {
            "items": {
              "additionalProperties": false,
              "properties": {
                "anonymous_system_id": {
                  "enum": [
                    "sys_3b7608d8be4f1ef45f11e2ef",
                    "sys_544d94026d3cd9da78cdc585",
                    "sys_69d064e7ab48f457b1847a7c",
                    "sys_6bb24da67b12cf5151b5d179"
                  ],
                  "type": "string"
                },
                "assessment": {
                  "maxLength": 600,
                  "minLength": 1,
                  "type": "string"
                },
                "candidate_id": {
                  "enum": [
                    "candidate_159babdbda6acfe6",
                    "candidate_1d0bcd4f6ed22861",
                    "candidate_26500385c10519ef",
                    "candidate_2e74bd47f66c76ad",
                    "candidate_368dc549dbba313f",
                    "candidate_3f73ee8bb04ee052",
                    "candidate_4477e0c580eeaf0f",
                    "candidate_473a7cc73ef551ea",
                    "candidate_48324e904b930420",
                    "candidate_4f46d35f2e2667ca",
                    "candidate_6b0ae4ac42937611",
                    "candidate_737064038099ef2a",
                    "candidate_8ba2743da2b9cb9e",
                    "candidate_9442184e2836ee47",
                    "candidate_995f11a38ef0e583",
                    "candidate_adab5d4da9ab2be6",
                    "candidate_b45014a64a6a9c53",
                    "candidate_b6ce4961df030128",
                    "candidate_b7730933ffbad510",
                    "candidate_bf1aa4701bd6f761",
                    "candidate_c09a0f37fab1e353"
                  ],
                  "type": "string"
                },
                "completeness_x4": {
                  "maximum": 4,
                  "minimum": 0,
                  "type": "integer"
                },
                "editorial_value_x4": {
                  "maximum": 4,
                  "minimum": 0,
                  "type": "integer"
                },
                "event_match_x4": {
                  "maximum": 4,
                  "minimum": 0,
                  "type": "integer"
                },
                "evidence_fidelity_x4": {
                  "maximum": 4,
                  "minimum": 0,
                  "type": "integer"
                },
                "highlight_id": {
                  "enum": [
                    "hl_011ed515bfe186d9695c79db",
                    "hl_078a6b54fd7aea6c1ba729d9",
                    "hl_0c9a3522bdf66ebd48dd32d6",
                    "hl_17b3dda85db57a3e662f84a0",
                    "hl_186f80a4b2724cc12320754b",
                    "hl_1982b5438d657a53111c5c2b",
                    "hl_25f56c0089b2ead05a3a1189",
                    "hl_281056c43fd499f4c701973e",
                    "hl_28e7f1b34e56840137986260",
                    "hl_40b13bbda794ae6bd7234b82",
                    "hl_45668cc4769bbab067db87ac",
                    "hl_46cd9309d1d5044e67d33b06",
                    "hl_49c84b1fe0bba9cde5fc70e4",
                    "hl_49f592f635262ee15cfc714a",
                    "hl_5107914a4b4109715c1d30dc",
                    "hl_58f99b337c9372ab70793911",
                    "hl_591d069a89df692ef1f82392",
                    "hl_633c536a6b7f03756475d0d3",
                    "hl_66ac21d8ecf6b17dbd38d5dd",
                    "hl_6d69161b6289f01210935c8e",
                    "hl_6fcedbdd4bf14ee3f4cd7ef8",
                    "hl_7d5ff3653503ec17a2befba9",
                    "hl_8b203d1a1d170e12d1b38010",
                    "hl_8f0495b05479196e4aeec95b",
                    "hl_8f724246af019f63735968c5",
                    "hl_94473476f13455c1a802bf87",
                    "hl_962fccac0c46089e3083784a",
                    "hl_98590aab8220100c23bb05cd",
                    "hl_a5f8084e7b78453b76760627",
                    "hl_ade4c322113b59744f3ea916",
                    "hl_b66ce3864927d65fe77c5554",
                    "hl_b6aedb0cda511f558561449a",
                    "hl_ba4a8f3174bf643c1056f359",
                    "hl_bd073eecbfb04e3896352994",
                    "hl_ca194e14877ef78023b0cdc5",
                    "hl_d1233609964baa7e89068a3d",
                    "hl_dd87cab85d4681d56962993f",
                    "hl_dea6e0713e219782c28e920c",
                    "hl_f07a4943866974e97235f4a7",
                    "hl_f7b532fa0275692e3486972d",
                    "hl_f7d348b2a223551f427ecb6a"
                  ],
                  "type": "string"
                },
                "hook_x4": {
                  "maximum": 4,
                  "minimum": 0,
                  "type": "integer"
                },
                "usability_x4": {
                  "maximum": 4,
                  "minimum": 0,
                  "type": "integer"
                }
              },
              "required": [
                "anonymous_system_id",
                "highlight_id",
                "candidate_id",
                "event_match_x4",
                "editorial_value_x4",
                "hook_x4",
                "completeness_x4",
                "evidence_fidelity_x4",
                "usability_x4",
                "assessment"
              ],
              "type": "object"
            },
            "maxItems": 41,
            "minItems": 1,
            "type": "array"
          },
          "topic_assessment": {
            "maxLength": 1000,
            "minLength": 1,
            "type": "string"
          }
        },
        "required": [
          "cluster_id",
          "canonical_topic",
          "alignment_confidence",
          "members",
          "topic_assessment"
        ],
        "type": "object"
      },
      "maxItems": 41,
      "minItems": 1,
      "type": "array"
    }
  },
  "required": [
    "schema_version",
    "topic_clusters",
    "system_evaluations",
    "preferred_system_ids",
    "overall_verdict",
    "limitations"
  ],
  "type": "object"
}
