{"limitations":["仅提供转写及候选上下文，无法核验歌声、手势、纸张演示和实际剪辑边界。","证据忠实度只衡量候选与所给转写的一致性，不代表声乐、嗓音健康、课程效果或退费主张真实有效。","部分转写含明显识别错误，涉及声带闭合等内容时只能对合理清理后的表述降置信评价。"],"overall_verdict":"sys_544d94026d3cd9da78cdc585 的组合最稳定：选题集中于可独立成片的教学事件，原话保留、Hook、完整性和风险提示整体最佳。sys_3b7608d8be4f1ef45f11e2ef 的表达同样鲜明且发现面更广，但鼻音地域概括和「85%靠天赋」等高争议内容降低了成片稳定性。另两组覆盖更广，却纳入较多直播运营、课程推销及信息不闭合片段，且概括式高光削弱了现场张力。","preferred_system_ids":["sys_544d94026d3cd9da78cdc585"],"schema_version":"1","system_evaluations":[{"anonymous_system_id":"sys_544d94026d3cd9da78cdc585","coverage_x4":3,"discovery_x4":3,"editorial_readiness_x4":4,"precision_x4":4,"stability_x4":4,"strengths":["八个高光均围绕清晰、可辨认的声乐教学事件，几乎没有纯运营或纯商业片段。","高光句多保留原话的反问和诊断细节，Hook与独立成片能力强。","风险提示能区分个案建议、绝对化观点、营销语境和视听依赖。"],"weaknesses":["覆盖面小于另外两套十二条组合，未发现高音通道、个人教学经历、听声优先及人物故事等事件。","若干专业判断仍可能被包装成普遍规则，嗓音健康风险标注不够统一。"]},{"anonymous_system_id":"sys_69d064e7ab48f457b1847a7c","coverage_x4":4,"discovery_x4":4,"editorial_readiness_x4":2,"precision_x4":3,"stability_x4":3,"strengths":["覆盖直播开场、高音问题、教学经历、课程商业信息等多种事件。","能识别视觉核验、内容不完整、商业承诺和健康表述等风险。","对原讲者的绝对化说法多采用审慎转述。"],"weaknesses":["高光句普遍是第三人称概括，损失原片反问、冲突和现场诊断的感染力。","纳入直播运营和集中课程推销等低编辑价值内容，并在穿透力事件中产生一定重复。","部分风险标签过于宽泛，课程语境即标广告、普通教学判断即标健康风险，区分度有限。"]},{"anonymous_system_id":"sys_3b7608d8be4f1ef45f11e2ef","coverage_x4":3,"discovery_x4":4,"editorial_readiness_x4":3,"precision_x4":4,"stability_x4":3,"strengths":["原话提炼鲜明，反问式Hook和具体诊断细节保留充分。","独立发现鼻音与高音集中度、跨唱法能力迁移等其他组合较少覆盖的事件。","大多数脚本描述明确指出应从哪里开剪及需要删除的直播杂讯。"],"weaknesses":["地域鼻音概括和「流行85%靠天赋」均具有较高争议，虽有风险提示仍需大幅编辑。","缺少高音基础通道、个人教学经历、课程选择和听声优先等事件。","少数高光句在结论闭合前结束，完整信息更多依赖脚本描述。"]},{"anonymous_system_id":"sys_6bb24da67b12cf5151b5d179","coverage_x4":4,"discovery_x4":4,"editorial_readiness_x4":2,"precision_x4":3,"stability_x4":3,"strengths":["覆盖面广，并发现听实际声音再判断姿态、跨专业原创音乐梦等独特事件。","概括措辞审慎，通常没有把个案诊断直接写成确定事实。","对商业承诺、视听依赖和不完整结论的风险识别较充分。"],"weaknesses":["组合中课程价格、退费和效果推广占比偏高，稀释了教学内容密度。","多个高光使用抽象概括和陈述式Hook，现场个性及传播张力不足。","部分片段仅提出问题或教学框架，没有保留后续试听、诊断或可执行解释。"]}],"topic_clusters":[{"alignment_confidence":"high","canonical_topic":"唱歌发力不能照搬健身憋气，发声直接来源于声带振动","cluster_id":"topic_014","members":[{"anonymous_system_id":"sys_544d94026d3cd9da78cdc585","assessment":"完整保留健身类比、反常识反问和声带振动结论，传播张力最强；发布时仍需避免把呼吸支持一并否定。","candidate_id":"candidate_737064038099ef2a","completeness_x4":4,"editorial_value_x4":4,"event_match_x4":4,"evidence_fidelity_x4":4,"highlight_id":"hl_94473476f13455c1a802bf87","hook_x4":4,"usability_x4":3},{"anonymous_system_id":"sys_69d064e7ab48f457b1847a7c","assessment":"准确抓住卧推发力不可照搬的冲突，但高光句省略声带振动和演示细节，信息闭合度略低。","candidate_id":"candidate_737064038099ef2a","completeness_x4":3,"editorial_value_x4":3,"event_match_x4":4,"evidence_fidelity_x4":4,"highlight_id":"hl_45668cc4769bbab067db87ac","hook_x4":4,"usability_x4":3},{"anonymous_system_id":"sys_3b7608d8be4f1ef45f11e2ef","assessment":"原话反问很有冲击力，也把注意力带到声带位置；句子停在设问处，需接后续振动或纸张演示才能完全闭合。","candidate_id":"candidate_737064038099ef2a","completeness_x4":3,"editorial_value_x4":4,"event_match_x4":4,"evidence_fidelity_x4":4,"highlight_id":"hl_40b13bbda794ae6bd7234b82","hook_x4":4,"usability_x4":3},{"anonymous_system_id":"sys_6bb24da67b12cf5151b5d179","assessment":"概括同时覆盖错误类比和声带振动结论，语义完整而审慎，但不如原话版本有现场感。","candidate_id":"candidate_737064038099ef2a","completeness_x4":4,"editorial_value_x4":3,"event_match_x4":4,"evidence_fidelity_x4":4,"highlight_id":"hl_962fccac0c46089e3083784a","hook_x4":4,"usability_x4":3}],"topic_assessment":"四条均对应同一段健身类比教学。原话型候选更有Hook，概括型候选更稳健；所有版本都需要原画面或清楚音频支持演示。"},{"alignment_confidence":"high","canonical_topic":"胸腹式联合呼吸只是起点，还需落实到实际演唱","cluster_id":"topic_024","members":[{"anonymous_system_id":"sys_544d94026d3cd9da78cdc585","assessment":"从常见提问、术语纠正到应用不足形成完整问答，信息密度和独立成片能力均强。","candidate_id":"candidate_2e74bd47f66c76ad","completeness_x4":4,"editorial_value_x4":4,"event_match_x4":4,"evidence_fidelity_x4":4,"highlight_id":"hl_8b203d1a1d170e12d1b38010","hook_x4":4,"usability_x4":4},{"anonymous_system_id":"sys_69d064e7ab48f457b1847a7c","assessment":"忠实保留「感觉不等于会唱」的核心，但高光句略去术语纠正过程，现场辨识度较低。","candidate_id":"candidate_2e74bd47f66c76ad","completeness_x4":3,"editorial_value_x4":3,"event_match_x4":4,"evidence_fidelity_x4":4,"highlight_id":"hl_49c84b1fe0bba9cde5fc70e4","hook_x4":4,"usability_x4":3},{"anonymous_system_id":"sys_3b7608d8be4f1ef45f11e2ef","assessment":"问题式开场与重复纠正术语都很抓人，但高光句没有带出「用于唱歌才是关键」的后半结论。","candidate_id":"candidate_2e74bd47f66c76ad","completeness_x4":3,"editorial_value_x4":4,"event_match_x4":4,"evidence_fidelity_x4":4,"highlight_id":"hl_58f99b337c9372ab70793911","hook_x4":4,"usability_x4":3},{"anonymous_system_id":"sys_6bb24da67b12cf5151b5d179","assessment":"术语和应用两个要点都概括到位，证据忠实且闭合；表达偏说明文，传播个性稍弱。","candidate_id":"candidate_2e74bd47f66c76ad","completeness_x4":4,"editorial_value_x4":3,"event_match_x4":4,"evidence_fidelity_x4":4,"highlight_id":"hl_f07a4943866974e97235f4a7","hook_x4":4,"usability_x4":3}],"topic_assessment":"四条高度对齐同一问答。最适合的剪法是保留提问、术语纠正和「还要用于唱歌」三步，同时删除年龄闲聊与课程推广。"},{"alignment_confidence":"high","canonical_topic":"普通爱好者学唱歌不必先证明自己有天赋","cluster_id":"topic_034","members":[{"anonymous_system_id":"sys_544d94026d3cd9da78cdc585","assessment":"核心态度准确、简洁，连续反问有记忆点；句子没有显式区分兴趣学习与职业目标，完整性略逊。","candidate_id":"candidate_473a7cc73ef551ea","completeness_x4":3,"editorial_value_x4":4,"event_match_x4":4,"evidence_fidelity_x4":4,"highlight_id":"hl_28e7f1b34e56840137986260","hook_x4":4,"usability_x4":4},{"anonymous_system_id":"sys_3b7608d8be4f1ef45f11e2ef","assessment":"同时保留学习者疑问、出道反问和普通人结论，是该事件最自然完整的原话提炼。","candidate_id":"candidate_473a7cc73ef551ea","completeness_x4":4,"editorial_value_x4":4,"event_match_x4":4,"evidence_fidelity_x4":4,"highlight_id":"hl_ba4a8f3174bf643c1056f359","hook_x4":4,"usability_x4":4},{"anonymous_system_id":"sys_6bb24da67b12cf5151b5d179","assessment":"把隐含的兴趣与职业目标区别说清楚，逻辑完整；属于合理归纳而非源中的原句，且需要避开前部招揽。","candidate_id":"candidate_473a7cc73ef551ea","completeness_x4":4,"editorial_value_x4":3,"event_match_x4":4,"evidence_fidelity_x4":4,"highlight_id":"hl_f7d348b2a223551f427ecb6a","hook_x4":4,"usability_x4":3}],"topic_assessment":"三条均准确覆盖同一段天赋焦虑问答。内容鼓励性强，但不应与讲者另一段「流行85%靠天赋」合并，否则会造成明显立场冲突。"},{"alignment_confidence":"high","canonical_topic":"声乐纠错要先处理基础问题并按个体情况安排顺序","cluster_id":"topic_044","members":[{"anonymous_system_id":"sys_544d94026d3cd9da78cdc585","assessment":"列出闭合、挤压、假声、戏腔和强混等具体例子，论点完整；「声带不闭合」来自明显的转写清理，忠实度需留余量。","candidate_id":"candidate_adab5d4da9ab2be6","completeness_x4":4,"editorial_value_x4":4,"event_match_x4":4,"evidence_fidelity_x4":3,"highlight_id":"hl_a5f8084e7b78453b76760627","hook_x4":3,"usability_x4":3},{"anonymous_system_id":"sys_69d064e7ab48f457b1847a7c","assessment":"准确概括个体化与顺序原则，Hook清楚，但省略了支持观点的具体训练例子。","candidate_id":"candidate_adab5d4da9ab2be6","completeness_x4":2,"editorial_value_x4":3,"event_match_x4":4,"evidence_fidelity_x4":4,"highlight_id":"hl_6fcedbdd4bf14ee3f4cd7ef8","hook_x4":4,"usability_x4":3},{"anonymous_system_id":"sys_3b7608d8be4f1ef45f11e2ef","assessment":"完整保留训练顺序、基础问题和个体分析的论证，适合知识片；同样依赖对「不必合」的专业化清理。","candidate_id":"candidate_adab5d4da9ab2be6","completeness_x4":4,"editorial_value_x4":4,"event_match_x4":4,"evidence_fidelity_x4":3,"highlight_id":"hl_25f56c0089b2ead05a3a1189","hook_x4":3,"usability_x4":3}],"topic_assessment":"三条对应同一教学段。具体例子显著增强编辑价值，但「不能学」等绝对措辞应改为个案化建议，并在直播导流前结束。"},{"alignment_confidence":"high","canonical_topic":"咬字问题需要逐字按歌纠正，自学者难以判断自己是否做对","cluster_id":"topic_054","members":[{"anonymous_system_id":"sys_544d94026d3cd9da78cdc585","assessment":"痛点、纠正方式和判断障碍全部覆盖，问答可独立成立；需删去录播课「没有用」的绝对营销表达。","candidate_id":"candidate_1d0bcd4f6ed22861","completeness_x4":4,"editorial_value_x4":4,"event_match_x4":4,"evidence_fidelity_x4":4,"highlight_id":"hl_46cd9309d1d5044e67d33b06","hook_x4":4,"usability_x4":3},{"anonymous_system_id":"sys_69d064e7ab48f457b1847a7c","assessment":"逐字、按歌调整的建议忠实明确，但对「无法自判」这一核心障碍呈现不足，且后续推广较重。","candidate_id":"candidate_1d0bcd4f6ed22861","completeness_x4":3,"editorial_value_x4":3,"event_match_x4":4,"evidence_fidelity_x4":4,"highlight_id":"hl_8f0495b05479196e4aeec95b","hook_x4":4,"usability_x4":3}],"topic_assessment":"两条来自同一段个案建议。教学痛点具有编辑价值，但若从「录播课无用」切入，容易变成一对一课程广告。"},{"alignment_confidence":"high","canonical_topic":"通过课程录屏复听，并按个人问题判断声音位置应靠前还是靠后","cluster_id":"topic_064","members":[{"anonymous_system_id":"sys_544d94026d3cd9da78cdc585","assessment":"同时保留录屏复盘、网络建议冲突和个体判断例子，主题完整且Hook强，课程营销语境仍需收紧。","candidate_id":"candidate_26500385c10519ef","completeness_x4":4,"editorial_value_x4":4,"event_match_x4":4,"evidence_fidelity_x4":4,"highlight_id":"hl_281056c43fd499f4c701973e","hook_x4":4,"usability_x4":3},{"anonymous_system_id":"sys_69d064e7ab48f457b1847a7c","assessment":"只提炼出录屏回看的功能，遗漏「靠前还是靠后因人而异」这一更有价值的冲突和结论。","candidate_id":"candidate_26500385c10519ef","completeness_x4":2,"editorial_value_x4":2,"event_match_x4":3,"evidence_fidelity_x4":4,"highlight_id":"hl_d1233609964baa7e89068a3d","hook_x4":3,"usability_x4":2},{"anonymous_system_id":"sys_3b7608d8be4f1ef45f11e2ef","assessment":"从网络建议矛盾直接切入，再用声音紧的个案说明，原话清楚且易剪；须避免把个案例子当统一处方。","candidate_id":"candidate_26500385c10519ef","completeness_x4":4,"editorial_value_x4":4,"event_match_x4":4,"evidence_fidelity_x4":4,"highlight_id":"hl_186f80a4b2724cc12320754b","hook_x4":4,"usability_x4":4},{"anonymous_system_id":"sys_6bb24da67b12cf5151b5d179","assessment":"录屏复盘和个体化位置判断均有覆盖，但概括较平，且商业课程属性明显。","candidate_id":"candidate_26500385c10519ef","completeness_x4":3,"editorial_value_x4":3,"event_match_x4":4,"evidence_fidelity_x4":4,"highlight_id":"hl_5107914a4b4109715c1d30dc","hook_x4":4,"usability_x4":3}],"topic_assessment":"四条对齐同一课程录屏事件。真正的编辑核心是「网上意见冲突，因为每个人问题不同」，而不是单纯宣传录屏服务。"},{"alignment_confidence":"medium","canonical_topic":"美声、民族与流行的发声通道差异，以及声音过白带来的负担","cluster_id":"topic_074","members":[{"anonymous_system_id":"sys_544d94026d3cd9da78cdc585","assessment":"三种唱法对比具体，跨唱法为何需要调整也已闭合；位置分类较简化，只宜作为讲者框架呈现。","candidate_id":"candidate_b45014a64a6a9c53","completeness_x4":4,"editorial_value_x4":4,"event_match_x4":4,"evidence_fidelity_x4":4,"highlight_id":"hl_b6aedb0cda511f558561449a","hook_x4":4,"usability_x4":3},{"anonymous_system_id":"sys_3b7608d8be4f1ef45f11e2ef","assessment":"原话清晰列出美声、民族、流行的位置区别，主题集中；「前、后、中间」不能包装成公认绝对规则。","can